BEGIN;
BEGIN
SET client_min_messages TO NOTICE;
SET
--q1
/*
bigint (-9,223,372,036,854,775,808) to (9,223,372,036,854,775,807)
int	(-2,147,483,648) to (2,147,483,647)
*/
/*
Testing for ids > 10^8
*/
UPDATE edge_table
SET id = id + POWER(10, 8),
	source = source + POWER(10, 8),
	target = target + POWER(10, 8);
UPDATE 18
--q2
UPDATE edge_table_vertices_pgr
SET id = id + POWER(10, 8);
UPDATE 17
--q3
SELECT * FROM pgr_contractGraph(
    'SELECT id, source, target, cost, reverse_cost FROM edge_table',
    ARRAY[1]::integer[], 1, ARRAY[]::BIGINT[], true);
 seq | type |    id     |  contracted_vertices  | source | target | cost
-----+------+-----------+-----------------------+--------+--------+------
   1 | v    | 100000002 | {100000001}           |     -1 |     -1 |   -1
   2 | v    | 100000005 | {100000007,100000008} |     -1 |     -1 |   -1
   3 | v    | 100000010 | {100000013}           |     -1 |     -1 |   -1
   4 | v    | 100000015 | {100000014}           |     -1 |     -1 |   -1
   5 | v    | 100000017 | {100000016}           |     -1 |     -1 |   -1
(5 rows)

--q4
SELECT * FROM pgr_contractGraph(
    'SELECT id, source, target, cost, reverse_cost FROM edge_table',
    ARRAY[2]::integer[], 1, ARRAY[]::BIGINT[], true);
 seq | type | id | contracted_vertices |  source   |  target   | cost
-----+------+----+---------------------+-----------+-----------+------
   1 | e    | -1 | {100000004}         | 100000009 | 100000003 |    2
   2 | e    | -2 | {100000008}         | 100000005 | 100000007 |    2
   3 | e    | -3 | {100000008}         | 100000007 | 100000005 |    2
   4 | e    | -4 | {100000012}         | 100000011 | 100000009 |    2
(4 rows)

--q5
SELECT * FROM pgr_contractGraph(
    'SELECT id, source, target, cost, reverse_cost FROM edge_table',
    ARRAY[1, 2]::integer[], 1, ARRAY[]::BIGINT[], true);
 seq | type |    id     |  contracted_vertices  |  source   |  target   | cost
-----+------+-----------+-----------------------+-----------+-----------+------
   1 | v    | 100000005 | {100000007,100000008} |        -1 |        -1 |   -1
   2 | v    | 100000015 | {100000014}           |        -1 |        -1 |   -1
   3 | v    | 100000017 | {100000016}           |        -1 |        -1 |   -1
   4 | e    |        -1 | {100000001,100000002} | 100000003 | 100000005 |    2
   5 | e    |        -2 | {100000004}           | 100000009 | 100000003 |    2
   6 | e    |        -3 | {100000010,100000013} | 100000005 | 100000011 |    2
   7 | e    |        -4 | {100000012}           | 100000011 | 100000009 |    2
(7 rows)

ROLLBACK;
ROLLBACK
/*
Testing for ids > 10^12
*/
BEGIN;
BEGIN
--q6
UPDATE edge_table
SET id = id + POWER(10, 12),
	source = source + POWER(10, 12),
	target = target + POWER(10, 12);
UPDATE 18
--q7
UPDATE edge_table_vertices_pgr
SET id = id + POWER(10, 12);
UPDATE 17
--q8
SELECT * FROM pgr_contractGraph(
    'SELECT id, source, target, cost, reverse_cost FROM edge_table',
    ARRAY[1]::integer[], 1, ARRAY[]::BIGINT[], true);
 seq | type |      id       |      contracted_vertices      | source | target | cost
-----+------+---------------+-------------------------------+--------+--------+------
   1 | v    | 1000000000002 | {1000000000001}               |     -1 |     -1 |   -1
   2 | v    | 1000000000005 | {1000000000007,1000000000008} |     -1 |     -1 |   -1
   3 | v    | 1000000000010 | {1000000000013}               |     -1 |     -1 |   -1
   4 | v    | 1000000000015 | {1000000000014}               |     -1 |     -1 |   -1
   5 | v    | 1000000000017 | {1000000000016}               |     -1 |     -1 |   -1
(5 rows)

--q9
SELECT * FROM pgr_contractGraph(
    'SELECT id, source, target, cost, reverse_cost FROM edge_table',
    ARRAY[2]::integer[], 1, ARRAY[]::BIGINT[], true);
 seq | type | id | contracted_vertices |    source     |    target     | cost
-----+------+----+---------------------+---------------+---------------+------
   1 | e    | -1 | {1000000000004}     | 1000000000009 | 1000000000003 |    2
   2 | e    | -2 | {1000000000008}     | 1000000000005 | 1000000000007 |    2
   3 | e    | -3 | {1000000000008}     | 1000000000007 | 1000000000005 |    2
   4 | e    | -4 | {1000000000012}     | 1000000000011 | 1000000000009 |    2
(4 rows)

--q10
SELECT * FROM pgr_contractGraph(
    'SELECT id, source, target, cost, reverse_cost FROM edge_table',
    ARRAY[1, 2]::integer[], 1, ARRAY[]::BIGINT[], true);
 seq | type |      id       |      contracted_vertices      |    source     |    target     | cost
-----+------+---------------+-------------------------------+---------------+---------------+------
   1 | v    | 1000000000005 | {1000000000007,1000000000008} |            -1 |            -1 |   -1
   2 | v    | 1000000000015 | {1000000000014}               |            -1 |            -1 |   -1
   3 | v    | 1000000000017 | {1000000000016}               |            -1 |            -1 |   -1
   4 | e    |            -1 | {1000000000001,1000000000002} | 1000000000003 | 1000000000005 |    2
   5 | e    |            -2 | {1000000000004}               | 1000000000009 | 1000000000003 |    2
   6 | e    |            -3 | {1000000000010,1000000000013} | 1000000000005 | 1000000000011 |    2
   7 | e    |            -4 | {1000000000012}               | 1000000000011 | 1000000000009 |    2
(7 rows)

--q11
ROLLBACK;
ROLLBACK
