BEGIN;
BEGIN
SET client_min_messages TO NOTICE;
SET
/* -- q0 */
SELECT id, source, target, cost FROM edges ORDER BY id;
 id | source | target | cost
----+--------+--------+------
  1 |      5 |      6 |    1
  2 |      6 |     10 |   -1
  3 |     10 |     15 |   -1
  4 |      6 |      7 |    1
  5 |     10 |     11 |    1
  6 |      1 |      3 |    1
  7 |      3 |      7 |    1
  8 |      7 |     11 |    1
  9 |     11 |     16 |    1
 10 |      7 |      8 |    1
 11 |     11 |     12 |    1
 12 |      8 |     12 |    1
 13 |     12 |     17 |    1
 14 |      8 |      9 |    1
 15 |     16 |     17 |    1
 16 |     15 |     16 |    1
 17 |      2 |      4 |    1
 18 |     13 |     14 |    1
(18 rows)

/* -- q1 */
SELECT * FROM pgr_contractionHierarchies(
  'SELECT id, source, target, cost FROM edges',
  directed => false);
 type | id | contracted_vertices | source | target | cost | metric | vertex_order
------+----+---------------------+--------+--------+------+--------+--------------
 v    |  1 | {}                  |     -1 |     -1 |   -1 |     -1 |            3
 v    |  2 | {}                  |     -1 |     -1 |   -1 |     -1 |           10
 v    |  3 | {}                  |     -1 |     -1 |   -1 |     -1 |            4
 v    |  4 | {}                  |     -1 |     -1 |   -1 |      0 |           15
 v    |  5 | {}                  |     -1 |     -1 |   -1 |     -1 |           14
 v    |  6 | {}                  |     -1 |     -1 |   -1 |     -1 |            6
 v    |  7 | {}                  |     -1 |     -1 |   -1 |     -1 |            5
 v    |  8 | {}                  |     -1 |     -1 |   -1 |     -1 |            9
 v    |  9 | {}                  |     -1 |     -1 |   -1 |     -2 |            2
 v    | 10 | {}                  |     -1 |     -1 |   -1 |     -1 |            7
 v    | 11 | {}                  |     -1 |     -1 |   -1 |     -1 |            8
 v    | 12 | {}                  |     -1 |     -1 |   -1 |     -2 |            1
 v    | 13 | {}                  |     -1 |     -1 |   -1 |     -1 |           11
 v    | 14 | {}                  |     -1 |     -1 |   -1 |      0 |           16
 v    | 15 | {}                  |     -1 |     -1 |   -1 |     -1 |           13
 v    | 16 | {}                  |     -1 |     -1 |   -1 |     -1 |           12
 v    | 17 | {}                  |     -1 |     -1 |   -1 |      0 |           17
 e    | -1 | {7}                 |     11 |      8 |    2 |     -1 |           -1
 e    | -2 | {7,8}               |     11 |      9 |    3 |     -1 |           -1
 e    | -3 | {8}                 |     12 |      9 |    2 |     -1 |           -1
 e    | -4 | {11}                |     12 |     16 |    2 |     -1 |           -1
(21 rows)

/* -- q2 */
SELECT * FROM pgr_contractionHierarchies(
  'SELECT id, source, target, cost FROM edges',
  directed => false,
  forbidden => ARRAY[6]);
 type | id  | contracted_vertices | source | target | cost | metric | vertex_order
------+-----+---------------------+--------+--------+------+--------+--------------
 v    |   1 | {}                  |     -1 |     -1 |   -1 |     -1 |            4
 v    |   2 | {}                  |     -1 |     -1 |   -1 |     -1 |            8
 v    |   3 | {}                  |     -1 |     -1 |   -1 |     -1 |            5
 v    |   4 | {}                  |     -1 |     -1 |   -1 |      0 |           15
 v    |   5 | {}                  |     -1 |     -1 |   -1 |     -1 |           12
 v    |   7 | {}                  |     -1 |     -1 |   -1 |      0 |           13
 v    |   8 | {}                  |     -1 |     -1 |   -1 |     -1 |            7
 v    |   9 | {}                  |     -1 |     -1 |   -1 |     -3 |            1
 v    |  10 | {}                  |     -1 |     -1 |   -1 |     -1 |            6
 v    |  11 | {}                  |     -1 |     -1 |   -1 |      0 |           14
 v    |  12 | {}                  |     -1 |     -1 |   -1 |     -2 |            2
 v    |  13 | {}                  |     -1 |     -1 |   -1 |     -1 |            9
 v    |  14 | {}                  |     -1 |     -1 |   -1 |      0 |           16
 v    |  15 | {}                  |     -1 |     -1 |   -1 |     -1 |           11
 v    |  16 | {}                  |     -1 |     -1 |   -1 |     -2 |            3
 v    |  17 | {}                  |     -1 |     -1 |   -1 |     -1 |           10
 e    |  -1 | {7}                 |      6 |     11 |    2 |     -1 |           -1
 e    |  -2 | {7}                 |      6 |      8 |    2 |     -1 |           -1
 e    |  -3 | {7}                 |     11 |      8 |    2 |     -1 |           -1
 e    |  -4 | {7,8}               |      6 |      9 |    3 |     -1 |           -1
 e    |  -5 | {7,8}               |     11 |      9 |    3 |     -1 |           -1
 e    |  -6 | {8}                 |     12 |      9 |    2 |     -1 |           -1
 e    |  -7 | {7,11}              |      6 |     12 |    3 |     -1 |           -1
 e    |  -8 | {7,11}              |      6 |     16 |    3 |     -1 |           -1
 e    |  -9 | {11}                |     12 |     16 |    2 |     -1 |           -1
 e    | -10 | {7,11,12}           |      6 |     17 |    4 |     -1 |           -1
(26 rows)

/* -- q3 */
ALTER TABLE edges
  ADD is_new BOOLEAN DEFAULT false,
  ADD contracted_vertices BIGINT[];
ALTER TABLE
/* -- q4 */
ALTER TABLE vertices
  ADD metric INTEGER,
  ADD vertex_order INTEGER;
ALTER TABLE
/* -- q5 */
SELECT * INTO contraction_results
FROM pgr_contractionHierarchies(
  'SELECT id, source, target, cost FROM edges',
  directed => false);
SELECT 21
/* -- q6 */
INSERT INTO edges(source, target, cost, reverse_cost, contracted_vertices, is_new)
  SELECT source, target, cost, -1, contracted_vertices, true
  FROM contraction_results
  WHERE type = 'e';
INSERT 0 4
/* -- q7 */
UPDATE vertices
  SET metric = c.metric, vertex_order = c.vertex_order
  FROM contraction_results c
  WHERE c.type = 'v' AND c.id = vertices.id;
UPDATE 17
/* -- q8 */
SELECT * FROM pgr_bdDijkstra(
  'SELECT id, source, target, cost, reverse_cost FROM edges',
  1, 17
);
 seq | path_seq | start_vid | end_vid | node | edge | cost | agg_cost
-----+----------+-----------+---------+------+------+------+----------
   1 |        1 |         1 |      17 |    1 |    6 |    1 |        0
   2 |        2 |         1 |      17 |    3 |    7 |    1 |        1
   3 |        3 |         1 |      17 |    7 |    8 |    1 |        2
   4 |        4 |         1 |      17 |   11 |   11 |    1 |        3
   5 |        5 |         1 |      17 |   12 |   13 |    1 |        4
   6 |        6 |         1 |      17 |   17 |   -1 |    0 |        5
(6 rows)

/* -- q9 */
ROLLBACK;
ROLLBACK
