BEGIN;
BEGIN
SET client_min_messages TO NOTICE;
SET
-- q00
SELECT id, source, target, cost, reverse_cost FROM edge_table;
 id | source | target | cost | reverse_cost
----+--------+--------+------+--------------
  1 |      1 |      2 |    1 |            1
  2 |      2 |      3 |   -1 |            1
  3 |      3 |      4 |   -1 |            1
  4 |      2 |      5 |    1 |            1
  5 |      3 |      6 |    1 |           -1
  6 |      7 |      8 |    1 |            1
  7 |      8 |      5 |    1 |            1
  8 |      5 |      6 |    1 |            1
  9 |      6 |      9 |    1 |            1
 10 |      5 |     10 |    1 |            1
 11 |      6 |     11 |    1 |           -1
 12 |     10 |     11 |    1 |           -1
 13 |     11 |     12 |    1 |           -1
 14 |     10 |     13 |    1 |            1
 15 |      9 |     12 |    1 |            1
 16 |      4 |      9 |    1 |            1
 17 |     14 |     15 |    1 |            1
 18 |     16 |     17 |    1 |            1
(18 rows)

-- q01
-- q1
ALTER TABLE edge_table_vertices_pgr ADD is_contracted BOOLEAN DEFAULT false;
ALTER TABLE
ALTER TABLE edge_table_vertices_pgr ADD contracted_vertices BIGINT[];
ALTER TABLE
ALTER TABLE edge_table ADD is_new BOOLEAN DEFAULT false;
ALTER TABLE
ALTER TABLE edge_table ADD contracted_vertices BIGINT[];
ALTER TABLE
-- q2
SELECT * FROM pgr_contraction(
    'SELECT id, source, target, cost, reverse_cost FROM edge_table',
    array[1,2], directed:=false);
 type | id | contracted_vertices | source | target | cost
------+----+---------------------+--------+--------+------
 v    |  5 | {7,8}               |     -1 |     -1 |   -1
 v    | 15 | {14}                |     -1 |     -1 |   -1
 v    | 17 | {16}                |     -1 |     -1 |   -1
 e    | -1 | {1,2}               |      3 |      5 |    2
 e    | -2 | {4}                 |      3 |      9 |    2
 e    | -3 | {10,13}             |      5 |     11 |    2
 e    | -4 | {12}                |      9 |     11 |    2
(7 rows)

-- q3
SELECT * INTO contraction_results
FROM pgr_contraction(
    'SELECT id, source, target, cost, reverse_cost FROM edge_table',
    array[1,2], directed:=false);
SELECT 7
-- q4
UPDATE edge_table_vertices_pgr
SET is_contracted = true
WHERE id IN (SELECT  unnest(contracted_vertices) FROM  contraction_results);
UPDATE 10
-- q5
SELECT id, is_contracted
FROM edge_table_vertices_pgr
ORDER BY id;
 id | is_contracted
----+---------------
  1 | t
  2 | t
  3 | f
  4 | t
  5 | f
  6 | f
  7 | t
  8 | t
  9 | f
 10 | t
 11 | f
 12 | t
 13 | t
 14 | t
 15 | f
 16 | t
 17 | f
(17 rows)

-- q6
UPDATE edge_table_vertices_pgr
SET contracted_vertices = contraction_results.contracted_vertices
FROM contraction_results
WHERE type = 'v' AND edge_table_vertices_pgr.id = contraction_results.id;
UPDATE 3
-- q7
SELECT id, contracted_vertices, is_contracted
FROM edge_table_vertices_pgr
ORDER BY id;
 id | contracted_vertices | is_contracted
----+---------------------+---------------
  1 |                     | t
  2 |                     | t
  3 |                     | f
  4 |                     | t
  5 | {7,8}               | f
  6 |                     | f
  7 |                     | t
  8 |                     | t
  9 |                     | f
 10 |                     | t
 11 |                     | f
 12 |                     | t
 13 |                     | t
 14 |                     | t
 15 | {14}                | f
 16 |                     | t
 17 | {16}                | f
(17 rows)

-- q8
INSERT INTO edge_table(source, target, cost, reverse_cost, contracted_vertices, is_new)
SELECT source, target, cost, -1, contracted_vertices, true
FROM contraction_results
WHERE type = 'e';
INSERT 0 4
-- q9
SELECT id, source, target, cost, reverse_cost, contracted_vertices, is_new
FROM edge_table
ORDER BY id;
 id | source | target | cost | reverse_cost | contracted_vertices | is_new
----+--------+--------+------+--------------+---------------------+--------
  1 |      1 |      2 |    1 |            1 |                     | f
  2 |      2 |      3 |   -1 |            1 |                     | f
  3 |      3 |      4 |   -1 |            1 |                     | f
  4 |      2 |      5 |    1 |            1 |                     | f
  5 |      3 |      6 |    1 |           -1 |                     | f
  6 |      7 |      8 |    1 |            1 |                     | f
  7 |      8 |      5 |    1 |            1 |                     | f
  8 |      5 |      6 |    1 |            1 |                     | f
  9 |      6 |      9 |    1 |            1 |                     | f
 10 |      5 |     10 |    1 |            1 |                     | f
 11 |      6 |     11 |    1 |           -1 |                     | f
 12 |     10 |     11 |    1 |           -1 |                     | f
 13 |     11 |     12 |    1 |           -1 |                     | f
 14 |     10 |     13 |    1 |            1 |                     | f
 15 |      9 |     12 |    1 |            1 |                     | f
 16 |      4 |      9 |    1 |            1 |                     | f
 17 |     14 |     15 |    1 |            1 |                     | f
 18 |     16 |     17 |    1 |            1 |                     | f
 19 |      3 |      5 |    2 |           -1 | {1,2}               | t
 20 |      3 |      9 |    2 |           -1 | {4}                 | t
 21 |      5 |     11 |    2 |           -1 | {10,13}             | t
 22 |      9 |     11 |    2 |           -1 | {12}                | t
(22 rows)

-- q10
SELECT id
FROM edge_table_vertices_pgr
WHERE is_contracted = false
ORDER BY id;
 id
----
  3
  5
  6
  9
 11
 15
 17
(7 rows)

-- q11
WITH
vertices_in_graph AS (
    SELECT id
    FROM edge_table_vertices_pgr
    WHERE is_contracted = false
)
SELECT id, source, target, cost, reverse_cost, contracted_vertices
FROM edge_table
WHERE source IN (SELECT * FROM vertices_in_graph)
AND target IN (SELECT * FROM vertices_in_graph)
ORDER BY id;
 id | source | target | cost | reverse_cost | contracted_vertices
----+--------+--------+------+--------------+---------------------
  5 |      3 |      6 |    1 |           -1 |
  8 |      5 |      6 |    1 |            1 |
  9 |      6 |      9 |    1 |            1 |
 11 |      6 |     11 |    1 |           -1 |
 19 |      3 |      5 |    2 |           -1 | {1,2}
 20 |      3 |      9 |    2 |           -1 | {4}
 21 |      5 |     11 |    2 |           -1 | {10,13}
 22 |      9 |     11 |    2 |           -1 | {12}
(8 rows)

-- case1
CREATE OR REPLACE FUNCTION my_dijkstra(
    departure BIGINT, destination BIGINT,
    OUT seq INTEGER, OUT path_seq INTEGER,
    OUT node BIGINT, OUT edge BIGINT,
    OUT cost FLOAT, OUT agg_cost FLOAT)
RETURNS SETOF RECORD AS
$BODY$
SELECT * FROM pgr_dijkstra(
    $$
    WITH
    vertices_in_graph AS (
        SELECT id
        FROM edge_table_vertices_pgr
        WHERE is_contracted = false
    )
    SELECT id, source, target, cost, reverse_cost
    FROM edge_table
    WHERE source IN (SELECT * FROM vertices_in_graph)
    AND target IN (SELECT * FROM vertices_in_graph)
    $$,
    departure, destination, false);
$BODY$
LANGUAGE SQL VOLATILE;
CREATE FUNCTION
-- use1
SELECT * FROM my_dijkstra(3, 11);
 seq | path_seq | node | edge | cost | agg_cost
-----+----------+------+------+------+----------
   1 |        1 |    3 |    5 |    1 |        0
   2 |        2 |    6 |   11 |    1 |        1
   3 |        3 |   11 |   -1 |    0 |        2
(3 rows)

-- use1-1
SELECT * FROM my_dijkstra(4, 11);
 seq | path_seq | node | edge | cost | agg_cost
-----+----------+------+------+------+----------
(0 rows)

-- use1-2
SELECT * FROM my_dijkstra(4, 7);
 seq | path_seq | node | edge | cost | agg_cost
-----+----------+------+------+------+----------
(0 rows)

-- case2
CREATE OR REPLACE FUNCTION my_dijkstra(
    departure BIGINT, destination BIGINT,
    OUT seq INTEGER, OUT path_seq INTEGER,
    OUT node BIGINT, OUT edge BIGINT,
    OUT cost FLOAT, OUT agg_cost FLOAT)
RETURNS SETOF RECORD AS
$BODY$
SELECT * FROM pgr_dijkstra(
    $$
    WITH
    edges_to_expand AS (
        SELECT id
        FROM edge_table
        WHERE ARRAY[$$ || departure || $$]::BIGINT[] <@ contracted_vertices
           OR ARRAY[$$ || destination || $$]::BIGINT[] <@ contracted_vertices
    ),

    vertices_in_graph AS (
        SELECT id
        FROM edge_table_vertices_pgr
        WHERE is_contracted = false

        UNION

        SELECT unnest(contracted_vertices)
        FROM edge_table
        WHERE id IN (SELECT id FROM edges_to_expand)
    )

    SELECT id, source, target, cost, reverse_cost
    FROM edge_table
    WHERE source IN (SELECT * FROM vertices_in_graph)
    AND target IN (SELECT * FROM vertices_in_graph)
    $$,
    departure, destination, false);
$BODY$
LANGUAGE SQL VOLATILE;
CREATE FUNCTION
-- use2
SELECT * FROM my_dijkstra(3, 11);
 seq | path_seq | node | edge | cost | agg_cost
-----+----------+------+------+------+----------
   1 |        1 |    3 |    5 |    1 |        0
   2 |        2 |    6 |   11 |    1 |        1
   3 |        3 |   11 |   -1 |    0 |        2
(3 rows)

-- use2-1
SELECT * FROM my_dijkstra(4, 11);
 seq | path_seq | node | edge | cost | agg_cost
-----+----------+------+------+------+----------
   1 |        1 |    4 |   16 |    1 |        0
   2 |        2 |    9 |   22 |    2 |        1
   3 |        3 |   11 |   -1 |    0 |        3
(3 rows)

-- use2-2
SELECT * FROM my_dijkstra(4, 7);
 seq | path_seq | node | edge | cost | agg_cost
-----+----------+------+------+------+----------
(0 rows)

-- case3
CREATE OR REPLACE FUNCTION my_dijkstra(
    departure BIGINT, destination BIGINT,
    OUT seq INTEGER, OUT path_seq INTEGER,
    OUT node BIGINT, OUT edge BIGINT,
    OUT cost FLOAT, OUT agg_cost FLOAT)
RETURNS SETOF RECORD AS
$BODY$
SELECT * FROM pgr_dijkstra(
    $$
    WITH
    edges_to_expand AS (
        SELECT id
        FROM edge_table
        WHERE ARRAY[$$ || departure || $$]::BIGINT[] <@ contracted_vertices
           OR ARRAY[$$ || destination || $$]::BIGINT[] <@ contracted_vertices
    ),

    vertices_to_expand AS (
        SELECT id
        FROM edge_table_vertices_pgr
        WHERE ARRAY[$$ || departure || $$]::BIGINT[] <@ contracted_vertices
           OR ARRAY[$$ || destination || $$]::BIGINT[] <@ contracted_vertices
    ),

    vertices_in_graph AS (
        SELECT id
        FROM edge_table_vertices_pgr
        WHERE is_contracted = false

        UNION

        SELECT unnest(contracted_vertices)
        FROM edge_table
        WHERE id IN (SELECT id FROM edges_to_expand)

        UNION

        SELECT unnest(contracted_vertices)
        FROM edge_table_vertices_pgr
        WHERE id IN (SELECT id FROM vertices_to_expand)
    )

    SELECT id, source, target, cost, reverse_cost
    FROM edge_table
    WHERE source IN (SELECT * FROM vertices_in_graph)
    AND target IN (SELECT * FROM vertices_in_graph)
    $$,
    departure, destination, false);
$BODY$
LANGUAGE SQL VOLATILE;
CREATE FUNCTION
-- use3
SELECT * FROM my_dijkstra(3, 11);
 seq | path_seq | node | edge | cost | agg_cost
-----+----------+------+------+------+----------
   1 |        1 |    3 |    5 |    1 |        0
   2 |        2 |    6 |   11 |    1 |        1
   3 |        3 |   11 |   -1 |    0 |        2
(3 rows)

-- use3-1
SELECT * FROM my_dijkstra(4, 11);
 seq | path_seq | node | edge | cost | agg_cost
-----+----------+------+------+------+----------
   1 |        1 |    4 |   16 |    1 |        0
   2 |        2 |    9 |   22 |    2 |        1
   3 |        3 |   11 |   -1 |    0 |        3
(3 rows)

-- use3-2
SELECT * FROM my_dijkstra(4, 7);
 seq | path_seq | node | edge | cost | agg_cost
-----+----------+------+------+------+----------
   1 |        1 |    4 |    3 |    1 |        0
   2 |        2 |    3 |   19 |    2 |        1
   3 |        3 |    5 |    7 |    1 |        3
   4 |        4 |    8 |    6 |    1 |        4
   5 |        5 |    7 |   -1 |    0 |        5
(5 rows)

-- end
ROLLBACK;
ROLLBACK
