BEGIN;
BEGIN
SET client_min_messages TO NOTICE;
SET
DROP TABLE edge_table_vertices_pgr;
DROP TABLE
UPDATE edge_table SET source = NULL,  target = NULL;
UPDATE 18
--q1
SELECT  pgr_createTopology('edge_table', 0.001);
NOTICE:  PROCESSING:
NOTICE:  pgr_createTopology('edge_table', 0.001, 'the_geom', 'id', 'source', 'target', rows_where := 'true', clean := f)
NOTICE:  Performing checks, please wait .....
NOTICE:  Creating Topology, Please wait...
NOTICE:  -------------> TOPOLOGY CREATED FOR  18 edges
NOTICE:  Rows with NULL geometry or NULL id: 0
NOTICE:  Vertices table for table public.edge_table is: public.edge_table_vertices_pgr
NOTICE:  ----------------------------------------------
 pgr_createtopology
--------------------
 OK
(1 row)

--q1.1
DROP TABLE edge_table_vertices_pgr;
DROP TABLE
UPDATE edge_table SET source = NULL,  target = NULL;
UPDATE 18
--q2
SELECT  pgr_createTopology('edge_table', 0.001,
    'the_geom', 'id', 'source', 'target');
NOTICE:  PROCESSING:
NOTICE:  pgr_createTopology('edge_table', 0.001, 'the_geom', 'id', 'source', 'target', rows_where := 'true', clean := f)
NOTICE:  Performing checks, please wait .....
NOTICE:  Creating Topology, Please wait...
NOTICE:  -------------> TOPOLOGY CREATED FOR  18 edges
NOTICE:  Rows with NULL geometry or NULL id: 0
NOTICE:  Vertices table for table public.edge_table is: public.edge_table_vertices_pgr
NOTICE:  ----------------------------------------------
 pgr_createtopology
--------------------
 OK
(1 row)

--q2.1
SET client_min_messages TO NOTICE;
SET
--q3
SELECT  pgr_createTopology('edge_table', 0.001,
    'id', 'the_geom');
NOTICE:  PROCESSING:
NOTICE:  pgr_createTopology('edge_table', 0.001, 'id', 'the_geom', 'source', 'target', rows_where := 'true', clean := f)
NOTICE:  Performing checks, please wait .....
NOTICE:  ----> PGR ERROR in pgr_createTopology: Wrong type of Column id:the_geom
NOTICE:  Unexpected error raise_exception
 pgr_createtopology
--------------------
 FAIL
(1 row)

--q3.1
SET client_min_messages TO WARNING;
SET
DROP TABLE edge_table_vertices_pgr;
DROP TABLE
UPDATE edge_table SET source = NULL,  target = NULL;
UPDATE 18
--q4
SELECT  pgr_createTopology('edge_table', 0.001,
    the_geom:='the_geom', id:='id', source:='source', target:='target');
 pgr_createtopology
--------------------
 OK
(1 row)

--q4.1
DROP TABLE edge_table_vertices_pgr;
DROP TABLE
UPDATE edge_table SET source = NULL,  target = NULL;
UPDATE 18
--q5
SELECT  pgr_createTopology('edge_table', 0.001,
    source:='source', id:='id', target:='target', the_geom:='the_geom');
 pgr_createtopology
--------------------
 OK
(1 row)

--q5.1
DROP TABLE edge_table_vertices_pgr;
DROP TABLE
UPDATE edge_table SET source = NULL,  target = NULL;
UPDATE 18
--q6
SELECT  pgr_createTopology('edge_table', 0.001, source:='source');
 pgr_createtopology
--------------------
 OK
(1 row)

--q6.1
--q7
SELECT  pgr_createTopology('edge_table', 0.001, rows_where:='id < 10');
 pgr_createtopology
--------------------
 OK
(1 row)

--q7.1
--q8
SELECT  pgr_createTopology('edge_table', 0.001,
    rows_where:='the_geom && (SELECT st_buffer(the_geom, 0.05) FROM edge_table WHERE id=5)');
 pgr_createtopology
--------------------
 OK
(1 row)

--q8.1
--q9
CREATE TABLE otherTable AS  (SELECT 100 AS gid,  st_point(2.5, 2.5) AS other_geom);
SELECT 1
SELECT  pgr_createTopology('edge_table', 0.001,
    rows_where:='the_geom && (SELECT st_buffer(other_geom, 1) FROM otherTable WHERE gid=100)');
 pgr_createtopology
--------------------
 OK
(1 row)

--q9.1
--q10
CREATE TABLE mytable AS (SELECT id AS gid,  the_geom AS mygeom, source AS src , target AS tgt FROM edge_table) ;
SELECT 18
--q10.1
--q11
SELECT  pgr_createTopology('mytable', 0.001, 'mygeom', 'gid', 'src', 'tgt', clean := TRUE);
 pgr_createtopology
--------------------
 OK
(1 row)

--q11.1
DROP TABLE mytable_vertices_pgr;
DROP TABLE
UPDATE mytable SET src = NULL,  tgt = NULL;
UPDATE 18
SET client_min_messages TO NOTICE;
SET
--q12
SELECT  pgr_createTopology('mytable', 0.001, 'gid', 'mygeom', 'src', 'tgt');
NOTICE:  PROCESSING:
NOTICE:  pgr_createTopology('mytable', 0.001, 'gid', 'mygeom', 'src', 'tgt', rows_where := 'true', clean := f)
NOTICE:  Performing checks, please wait .....
NOTICE:  ----> PGR ERROR in pgr_createTopology: Wrong type of Column id:mygeom
NOTICE:  Unexpected error raise_exception
 pgr_createtopology
--------------------
 FAIL
(1 row)

--q12.1
SET client_min_messages TO WARNING;
SET
--q13
SELECT  pgr_createTopology('mytable', 0.001, the_geom:='mygeom', id:='gid', source:='src', target:='tgt');
 pgr_createtopology
--------------------
 OK
(1 row)

--q13.1
DROP TABLE mytable_vertices_pgr;
DROP TABLE
UPDATE mytable SET src = NULL,  tgt = NULL;
UPDATE 18
--q14
SELECT  pgr_createTopology('mytable', 0.001, source:='src', id:='gid', target:='tgt', the_geom:='mygeom');
 pgr_createtopology
--------------------
 OK
(1 row)

--q14.1
--q15
SELECT  pgr_createTopology('mytable', 0.001, 'mygeom', 'gid', 'src', 'tgt', rows_where:='gid < 10');
 pgr_createtopology
--------------------
 OK
(1 row)

SELECT  pgr_createTopology('mytable', 0.001, source:='src', id:='gid', target:='tgt', the_geom:='mygeom', rows_where:='gid < 10');
 pgr_createtopology
--------------------
 OK
(1 row)

SELECT  pgr_createTopology('mytable', 0.001, 'mygeom', 'gid', 'src', 'tgt',
    rows_where:='mygeom && (SELECT st_buffer(mygeom, 1) FROM mytable WHERE gid=5)');
 pgr_createtopology
--------------------
 OK
(1 row)

SELECT  pgr_createTopology('mytable', 0.001, source:='src', id:='gid', target:='tgt', the_geom:='mygeom',
    rows_where:='mygeom && (SELECT st_buffer(mygeom, 1) FROM mytable WHERE gid=5)');
 pgr_createtopology
--------------------
 OK
(1 row)

--q15.1
--q16
SELECT  pgr_createTopology('mytable', 0.001, 'mygeom', 'gid', 'src', 'tgt',
    rows_where:='mygeom && (SELECT st_buffer(other_geom, 1) FROM otherTable WHERE gid=100)');
 pgr_createtopology
--------------------
 OK
(1 row)

SELECT  pgr_createTopology('mytable', 0.001, source:='src', id:='gid', target:='tgt', the_geom:='mygeom',
    rows_where:='mygeom && (SELECT st_buffer(other_geom, 1) FROM otherTable WHERE gid=100)');
 pgr_createtopology
--------------------
 OK
(1 row)

--q16.1
SET client_min_messages TO NOTICE;
SET
--q17
SELECT pgr_createTopology('edge_table',  0.001, rows_where:='id < 6', clean := true);
NOTICE:  PROCESSING:
NOTICE:  pgr_createTopology('edge_table', 0.001, 'the_geom', 'id', 'source', 'target', rows_where := 'id < 6', clean := t)
NOTICE:  Performing checks, please wait .....
NOTICE:  Creating Topology, Please wait...
NOTICE:  -------------> TOPOLOGY CREATED FOR  5 edges
NOTICE:  Rows with NULL geometry or NULL id: 0
NOTICE:  Vertices table for table public.edge_table is: public.edge_table_vertices_pgr
NOTICE:  ----------------------------------------------
 pgr_createtopology
--------------------
 OK
(1 row)

SELECT pgr_createTopology('edge_table',  0.001);
NOTICE:  PROCESSING:
NOTICE:  pgr_createTopology('edge_table', 0.001, 'the_geom', 'id', 'source', 'target', rows_where := 'true', clean := f)
NOTICE:  Performing checks, please wait .....
NOTICE:  Creating Topology, Please wait...
NOTICE:  -------------> TOPOLOGY CREATED FOR  13 edges
NOTICE:  Rows with NULL geometry or NULL id: 0
NOTICE:  Vertices table for table public.edge_table is: public.edge_table_vertices_pgr
NOTICE:  ----------------------------------------------
 pgr_createtopology
--------------------
 OK
(1 row)

--q17.1
SET client_min_messages TO NOTICE;
SET
ROLLBACK;
ROLLBACK
