BEGIN;
BEGIN
SET client_min_messages TO NOTICE;
SET
DROP TABLE IF EXISTS edges;
DROP TABLE
DROP TABLE IF EXISTS vertices;
DROP TABLE
DROP table if exists pointsOfInterest;
DROP TABLE
DROP TABLE IF EXISTS old_restrictions;
DROP TABLE
DROP TABLE IF EXISTS restrictions;
DROP TABLE
DROP TABLE IF EXISTS combinations;
DROP TABLE
DROP TABLE IF EXISTS vehicles;
DROP TABLE
DROP TABLE IF EXISTS orders;
DROP TABLE
/* --EDGE TABLE CREATE start */
CREATE TABLE edges (
    id BIGSERIAL PRIMARY KEY,
    source BIGINT,
    target BIGINT,
    cost FLOAT,
    reverse_cost FLOAT,
    capacity BIGINT,
    reverse_capacity BIGINT,
    x1 FLOAT,
    y1 FLOAT,
    x2 FLOAT,
    y2 FLOAT,
    geom geometry
);
CREATE TABLE
/* --EDGE TABLE CREATE end */
/* --EDGE TABLE ADD DATA start */
INSERT INTO edges (
    cost, reverse_cost,
    capacity, reverse_capacity, geom) VALUES
( 1,  1,  80, 130,   ST_MakeLine(ST_POINT(2, 0), ST_POINT(2, 1))),
(-1,  1,  -1, 100,   ST_MakeLine(ST_POINT(2, 1), ST_POINT(3, 1))),
(-1,  1,  -1, 130,   ST_MakeLine(ST_POINT(3, 1), ST_POINT(4, 1))),
( 1,  1, 100,  50,   ST_MakeLine(ST_POINT(2, 1), ST_POINT(2, 2))),
( 1, -1, 130,  -1,   ST_MakeLine(ST_POINT(3, 1), ST_POINT(3, 2))),
( 1,  1,  50, 100,   ST_MakeLine(ST_POINT(0, 2), ST_POINT(1, 2))),
( 1,  1,  50, 130,   ST_MakeLine(ST_POINT(1, 2), ST_POINT(2, 2))),
( 1,  1, 100, 130,   ST_MakeLine(ST_POINT(2, 2), ST_POINT(3, 2))),
( 1,  1, 130,  80,   ST_MakeLine(ST_POINT(3, 2), ST_POINT(4, 2))),
( 1,  1, 130,  50,   ST_MakeLine(ST_POINT(2, 2), ST_POINT(2, 3))),
( 1, -1, 130,  -1,   ST_MakeLine(ST_POINT(3, 2), ST_POINT(3, 3))),
( 1, -1, 100,  -1,   ST_MakeLine(ST_POINT(2, 3), ST_POINT(3, 3))),
( 1, -1, 100,  -1,   ST_MakeLine(ST_POINT(3, 3), ST_POINT(4, 3))),
( 1,  1,  80, 130,   ST_MakeLine(ST_POINT(2, 3), ST_POINT(2, 4))),
( 1,  1,  80,  50,   ST_MakeLine(ST_POINT(4, 2), ST_POINT(4, 3))),
( 1,  1,  80,  80,   ST_MakeLine(ST_POINT(4, 1), ST_POINT(4, 2))),
( 1,  1, 130, 100,   ST_MakeLine(ST_POINT(0.5, 3.5), ST_POINT(1.999999999999, 3.5))),
( 1,  1,  50, 130,   ST_MakeLine(ST_POINT(3.5, 2.3), ST_POINT(3.5, 4)));
INSERT 0 18
/* --EDGE TABLE ADD DATA end */
/* -- q1 */
SELECT * INTO vertices
FROM pgr_extractVertices('SELECT id, geom FROM edges ORDER BY id');
SELECT 17
/* -- q1-1 */
CREATE SEQUENCE vertices_id_seq;
CREATE SEQUENCE
ALTER TABLE vertices ALTER COLUMN id SET DEFAULT nextval('vertices_id_seq');
ALTER TABLE
ALTER SEQUENCE vertices_id_seq OWNED BY vertices.id;
ALTER SEQUENCE
SELECT setval('vertices_id_seq', (SELECT coalesce(max(id)) FROM vertices));
 setval
--------
     17
(1 row)

                                  Table "public.vertices"
  Column   |       Type       | Collation | Nullable |               Default
-----------+------------------+-----------+----------+--------------------------------------
 id        | bigint           |           |          | nextval('vertices_id_seq'::regclass)
 in_edges  | bigint[]         |           |          |
 out_edges | bigint[]         |           |          |
 x         | double precision |           |          |
 y         | double precision |           |          |
 geom      | geometry         |           |          |

/* -- q1-2 */
/* -- q2 */
SELECT * FROM vertices;
 id | in_edges | out_edges |       x        |  y  |                    geom
----+----------+-----------+----------------+-----+--------------------------------------------
  1 |          | {6}       |              0 |   2 | 010100000000000000000000000000000000000040
  2 |          | {17}      |            0.5 | 3.5 | 0101000000000000000000E03F0000000000000C40
  3 | {6}      | {7}       |              1 |   2 | 0101000000000000000000F03F0000000000000040
  4 | {17}     |           | 1.999999999999 | 3.5 | 010100000068EEFFFFFFFFFF3F0000000000000C40
  5 |          | {1}       |              2 |   0 | 010100000000000000000000400000000000000000
  6 | {1}      | {2,4}     |              2 |   1 | 01010000000000000000000040000000000000F03F
  7 | {4,7}    | {8,10}    |              2 |   2 | 010100000000000000000000400000000000000040
  8 | {10}     | {12,14}   |              2 |   3 | 010100000000000000000000400000000000000840
  9 | {14}     |           |              2 |   4 | 010100000000000000000000400000000000001040
 10 | {2}      | {3,5}     |              3 |   1 | 01010000000000000000000840000000000000F03F
 11 | {5,8}    | {9,11}    |              3 |   2 | 010100000000000000000008400000000000000040
 12 | {11,12}  | {13}      |              3 |   3 | 010100000000000000000008400000000000000840
 13 |          | {18}      |            3.5 | 2.3 | 01010000000000000000000C406666666666660240
 14 | {18}     |           |            3.5 |   4 | 01010000000000000000000C400000000000001040
 15 | {3}      | {16}      |              4 |   1 | 01010000000000000000001040000000000000F03F
 16 | {9,16}   | {15}      |              4 |   2 | 010100000000000000000010400000000000000040
 17 | {13,15}  |           |              4 |   3 | 010100000000000000000010400000000000000840
(17 rows)

/* -- q3 */
/* -- set the source information */
UPDATE edges AS e
SET source = v.id, x1 = x, y1 = y
FROM vertices AS v
WHERE ST_StartPoint(e.geom) = v.geom;
UPDATE 18
/* -- set the target information */
UPDATE edges AS e
SET target = v.id, x2 = x, y2 = y
FROM vertices AS v
WHERE ST_EndPoint(e.geom) = v.geom;
UPDATE 18
/* -- q4 */
SELECT id, source, target
FROM edges ORDER BY id;
 id | source | target
----+--------+--------
  1 |      5 |      6
  2 |      6 |     10
  3 |     10 |     15
  4 |      6 |      7
  5 |     10 |     11
  6 |      1 |      3
  7 |      3 |      7
  8 |      7 |     11
  9 |     11 |     16
 10 |      7 |      8
 11 |     11 |     12
 12 |      8 |     12
 13 |     12 |     17
 14 |      8 |      9
 15 |     16 |     17
 16 |     15 |     16
 17 |      2 |      4
 18 |     13 |     14
(18 rows)

/* -- q5 */
/* --POINTS CREATE start */
/* -- p1 */
CREATE TABLE pointsOfInterest(
    pid BIGSERIAL PRIMARY KEY,
    edge_id BIGINT,
    side CHAR,
    fraction FLOAT,
    geom geometry,
    newPoint geometry);
CREATE TABLE
/* -- p2 */
INSERT INTO pointsOfInterest (geom) VALUES
(ST_POINT(1.8, 0.4)),
(ST_POINT(4.2, 2.4)),
(ST_POINT(2.6, 3.2)),
(ST_POINT(0.3, 1.8)),
(ST_POINT(2.9, 1.8)),
(ST_POINT(2.2, 1.7));
INSERT 0 6
/* -- p3 */
UPDATE pointsOfInterest AS p SET
  edge_id = q.edge_id,
  side = q.side,
  fraction = q.fraction,
  newPoint = ST_endPoint(q.edge)
FROM (SELECT * FROM pgr_findCloseEdges(
  $$SELECT id, geom FROM edges$$,
  (SELECT array_agg(geom) FROM pointsOfInterest),
  0.5, partial => false)) AS q
WHERE p.geom = q.geom;
UPDATE 6
/* -- p4 */
UPDATE pointsOfInterest SET side = 'b'
WHERE pid = 6;
UPDATE 1
/* -- p5 */
SELECT pid, edge_id, side, fraction,
       ST_AsText(geom), ST_AsText(newPoint)
FROM pointsOfInterest
ORDER BY pid;
 pid | edge_id | side |      fraction      |   st_astext    |  st_astext
-----+---------+------+--------------------+----------------+--------------
   1 |       1 | l    |                0.4 | POINT(1.8 0.4) | POINT(2 0.4)
   2 |      15 | r    | 0.3999999999999999 | POINT(4.2 2.4) | POINT(4 2.4)
   3 |      12 | l    | 0.6000000000000001 | POINT(2.6 3.2) | POINT(2.6 3)
   4 |       6 | r    |                0.3 | POINT(0.3 1.8) | POINT(0.3 2)
   5 |       5 | l    |                0.8 | POINT(2.9 1.8) | POINT(3 1.8)
   6 |       4 | b    |                0.7 | POINT(2.2 1.7) | POINT(2 1.7)
(6 rows)

/* -- p6 */
/* --POINTS CREATE end */
/* --COMBINATIONS CREATE start */
/* -- c1 */
CREATE TABLE combinations (
    source BIGINT,
    target BIGINT
);
CREATE TABLE
/* -- c2 */
INSERT INTO combinations (
    source, target) VALUES
(5, 6),
(5, 10),
(6, 5),
(6, 15),
(6, 14);
INSERT 0 5
/* -- c3 */
SELECT * FROM combinations;
 source | target
--------+--------
      5 |      6
      5 |     10
      6 |      5
      6 |     15
      6 |     14
(5 rows)

/* -- c4 */
/* --COMBINATIONS CREATE end */
/* --RESTRICTIONS CREATE start */
/* -- r1 */
CREATE TABLE restrictions (
    id SERIAL PRIMARY KEY,
    path BIGINT[],
    cost FLOAT
);
CREATE TABLE
/* -- r2 */
INSERT INTO restrictions (path, cost) VALUES
(ARRAY[4, 7], 100),
(ARRAY[8, 11], 100),
(ARRAY[7, 10], 100),
(ARRAY[3, 5, 9], 4),
(ARRAY[9, 16], 100);
INSERT 0 5
/* -- r3 */
SELECT * FROM restrictions;
 id |  path   | cost
----+---------+------
  1 | {4,7}   |  100
  2 | {8,11}  |  100
  3 | {7,10}  |  100
  4 | {3,5,9} |    4
  5 | {9,16}  |  100
(5 rows)

/* -- r4 */
/* --RESTRICTIONS CREATE end */
/* --VEHICLES TABLE START */
CREATE TABLE vehicles (
  id BIGSERIAL PRIMARY KEY,
  capacity FLOAT,
  start_node_id BIGINT,
  start_x FLOAT,
  start_y FLOAT,
  start_open FLOAT,
  start_close FLOAT
);
CREATE TABLE
INSERT INTO vehicles
(start_node_id, start_x,  start_y,  start_open,  start_close, capacity) VALUES
(            11,       3,        2,           0,           50,       50),
(            11,       3,        2,           0,           50,       50);
INSERT 0 2
/* --VEHICLES TABLE END */
/* --ORDERS TABLE START */
CREATE TABLE orders (
    id BIGSERIAL PRIMARY KEY,
    demand FLOAT,
    /* the pickups */
    p_node_id BIGINT,
    p_x FLOAT,
    p_y FLOAT,
    p_open FLOAT,
    p_close FLOAT,
    p_service FLOAT,
    /* the deliveries */
    d_node_id BIGINT,
    d_x FLOAT,
    d_y FLOAT,
    d_open FLOAT,
    d_close FLOAT,
    d_service FLOAT
);
CREATE TABLE
INSERT INTO orders
(demand,
    p_node_id,  p_x, p_y,  p_open,  p_close,  p_service,
    d_node_id,  d_x, d_y,  d_open,  d_close,  d_service) VALUES
(10,
            10,    3,   1,      2,         10,          3,
            3,    1,   2,      6,         15,          3),
(20,
            16,    4,   2,      4,         15,          2,
            15,    4,   1,      6,         20,          3),
(30,
            7,    2,   2,      2,         10,          3,
           12,    3,   3,      3,         20,          3);
INSERT 0 3
/* --ORDERS TABLE END */
CREATE TABLE old_restrictions (
    rid BIGINT NOT NULL,
    to_cost FLOAT,
    target_id BIGINT,
    via_path TEXT
);
CREATE TABLE
/* --rest01 */
INSERT INTO old_restrictions (rid, to_cost, target_id, via_path) VALUES
(1, 100,  7,  '4'),
(1, 100, 11,  '8'),
(1, 100, 10,  '7'),
(2,   4,  9,  '5, 3'),
(3, 100,  9, '16');
INSERT 0 5
ROLLBACK;
ROLLBACK
